"Title","Body","Comment_Ups","Comment_Downs","Post_Ups","Post_Downs","Parent_Post","Score","Comment_Author","Post_Author","Sarcastic"
"These people have no fucking souls","Where Soros?   
",22,0,956,956,"",956,"Karlchen_","treny0000",1
"“THERES RESEARCH SUPPORTING THAT”","What about sephardi jews? Ot Ethiopian jews? And what if you’re jew but on your dad’s side? Asking for a friend ",2,0,1736,1736,"",1736,"Kaliforniah","champdo",1
"Hopelessly misinformed","Did you realise that immunizations contain viruses? They're merely spreading the virus to you! ",21,0,5411,5411,"",5411,"LostryTroll","maybesaydie",1
"20 million dead from the jab... No reliable sources of course","I heard 100 million people died from the vaccine.

",3,0,4179,4179,"",4179,"pjb1999","0604050606",1
"20 million dead from the jab... No reliable sources of course","It's true,  I'm one of those dead people who died on Oct 10th as determined by internal vaccine clock located next to the GPS and internal Wifi. ",1,0,4179,4179,"",4179,"RaymondMasseyXbox","0604050606",1
"Antivaxxer has totally sane concerns about nanoparticles in Covid test",">given the current state of the medical profession

… you mean the most advanced it’s ever been in human history? You mean the most likely candidate to save you if you have a life-threatening injury? You mean the field that’s filled with ultra dedicated employees who continue to perform literal miracles on a daily basis despite serving as a conservative dog whistle for the last 3 years?

Yeah buddy, you should definitely take your chances on this one. ",38,0,1254,1254,"",1254,"Difficult-Ad628","maybesaydie",1
"“You know the things”","Intelligence people always do start conversations telling people how intelligent they are. 

Seems legit.

",3,0,35,35,"",35,"CalgaryFacePalm","GuilhermeSidnei",1
"It's not a mystery","it's clearly because the left specially designed this virus with the help of communist china (a very left-wing country) to especially target people with right-wing opinions!

",13,0,5886,5886,"",5886,"SaintPanda_","maybesaydie",1
"Uh ya. We all realized you didn't care about us when you wouldn't spend 15 minutes to help protect us.","Gosh, can't imagine why...


Do you think it's something in the vaccine making us act funny?  ",25,0,3028,3028,"",3028,"Confident_Fortune_32","JordanAsquith",1
"Happy Activation Day! Is anyone else feeling the mRNA poison?","Mine's not working then. Maybe I need another booster. ",2,0,1420,1420,"",1420,"OldishWench","vrphotosguy55",1
"Happy Activation Day! Is anyone else feeling the mRNA poison?","Can confirm, my toxins were activated yesterday and I passed away. ",2,0,1420,1420,"",1420,"rva_obx","vrphotosguy55",1
"The Antivaxxer's Journey in Four Acts","Ah but you fools! Covid was just a cold. All the other ailments must have been caused by \*checks notes* the devil hiding in monster energy drink and other people's vaccines shedding.


",12,0,1169,1169,"",1169,"anaesthaesia","maybesaydie",1
"r/conspiracy: Ukraine and Russia are conspiring to kill us all with vaccines","I suppose it’s a slight improvement on the idea that we’re trying to kill our selves. Maybe they’ll come around to reality! ",1,0,2089,2089,"",2089,"basicalme","maybesaydie",1
"So maybe we didn’t turn into zombies last month, but NOW we’re definitely doomed 😆","There is an easy escape. They never specified the year 😉 ",1,0,29,29,"",29,"DisplacedAtom33","ghostgoddess7",1
"Vaccines work.","Yeah but people still died while being vaccinated in the UAE, which means they’re not perfect so they don’t work.
",195,0,5335,5335,"",5335,"giantsninerswarriors","JordanAsquith",1
"Vaccines work.","Don't you know that America has more people per capita than any other country?

Edit: ",59,0,5335,5335,"",5335,"_HossBonaventureCEO_","JordanAsquith",1
"Vaccines work.","But they don't have big pharma ",6,0,5335,5335,"",5335,"prokseus","JordanAsquith",1
"Thimerosal (ethyl-mercury) was removed from vaccines a while ago, so there's no more gay people anymore right?","Polio vaccines caused a spike in left-handedness! Don't believe me, Google when the polio vaccine was made and when left -handedness started rising! Sure it starts sooner than the vaccine, but that due to the tests. Don't comment I'm not excepting any criticism. /",1,0,265,265,"",265,"Vibe_with_Kira","JordanAsquith",1
"Duuuuhhhh, what do the lungs do again?","How does oxygen get into blood if oxygen is a gas and blood is a liquid? Checkmate science ",400,0,1317,1317,"",1317,"Irish_Wildling","JordanAsquith",1
"Well that’s all the evidence I need","The fact that I was injured in a car accident is utter proof that seatbelts/traffic laws/cars are bs.           ",4,0,26,26,"",26,"Tunaversity","cayce_leighann",1
"Ben Garrison is an idiot","Lagging on k-12 stem education has consequences. Who would’ve known?! ",2,0,8831,8831,"",8831,"shanghainese88","lazy_phoenix",1
"Ben Garrison is an idiot","So the purebloods are white too?  Makes sense, white Jesus and all.

",1,0,8831,8831,"",8831,"MasterHankShake","lazy_phoenix",1
"This anti-mRNA stuff is getting out of hand","Crazy thing is, 1 million patients a year lose their physician to suicide. Not saying that’s the case but it’s a statistic that’s never talked about. 

But definitely Covid shot, for sure. ",4,0,883,883,"",883,"THelperCell","Lazy_boa",1
"r/conspiracy is using carrot emojis like all the other antivaxxers","It's true though a vaccine turned me into a newt.

",8,0,1966,1966,"",1966,"Tasiam","maybesaydie",1
"r/conspiracy is using carrot emojis like all the other antivaxxers","Guys help my blood has Bluetooth. Alexa is in my *brain!*

",2,0,1966,1966,"",1966,"ToaSuutox","maybesaydie",1
"Because the military vaccinates everyone?","They're obviously testing if they can make armies of Captain America or Homelander's duh ",3,0,4223,4223,"",4223,"LilG1984","maybesaydie",1
"jake shields is one of the dumbest motherfuckers alive. scroll his twitter if you want a brain injury","I assume he took it now that it isn't experimental? ",10,0,449,449,"",449,"I_might_be_weasel","tangerinetarantula",1
"Anti-Vaxxers are straight up evil towards autistic people.","Normalizing COVID definitely isn’t “normalizing myocarditis” though   ^",2,0,1612,1612,"",1612,"Mysterious-Handle-34","TheDuckClock",1
"B-but they can cause autism 😭","Yeah but 30 years is way more qualification than 1 single century

&#x200B;

&#x200B;

&#x200B;

&#x200B;

&#x200B;

&#x200B;

&#x200B;

&#x200B;

&#x200B;

&#x200B;

&#x200B;

&#x200B;

&#x200B;

&#x200B;

&#x200B;

&#x200B;

&#x200B;

&#x200B;

&#x200B;

&#x200B;

&#x200B;

&#x200B;

&#x200B;

",2,0,5947,5947,"",5947,"HkayakH","mr_epicguy",1
"Mark your calender, get ready folks! Because here it comes, the vaccinated are going to turn into real life zombies!😱😱😱 (on September 3rd 2022)","Why do they each have exactly 17 thumbs down? 

17

1+7 = 8

September is one month after eight.

9/3 

9-3 = 6

If we take the 17 backwards, 7-1 also equals six.

PROOF, YOU SHEEPLE!!!!!!!!! PROOF!!!!! OPEN YOUR EYES!!!!!!


",190,0,2179,2179,"",2179,"GenuineDusk","Citrus_little",1
"Mark your calender, get ready folks! Because here it comes, the vaccinated are going to turn into real life zombies!😱😱😱 (on September 3rd 2022)","Didn’t turn into a zombie? Was the vaccine i got fake? ",1,0,2179,2179,"",2179,"pranay909","Citrus_little",1
"Mark your calender, get ready folks! Because here it comes, the vaccinated are going to turn into real life zombies!😱😱😱 (on September 3rd 2022)","If I were a Zombie I’d Starve these people don’t have any Braaains to eat ",1,0,2179,2179,"",2179,"TheHairball","Citrus_little",1
"Harvard is jumping on this now too, according to the anti vaxxers...","I thought institutions of higher education were communist indoctrination camps. They're using the garbage these ANTIFA-run brainwashing factories to support their claims? I don't get it! ",4,0,1464,1464,"",1464,"Calkky","Lazy_boa",1
"reddit user claims to have injected bleach to inactivate the vaccine","He started to feel better after stopping the bleach injections?

That's weird. 

Clearly the placebo effect. ^",422,0,2116,2116,"",2116,"feignapathy","maybesaydie",1
"reddit user claims to have injected bleach to inactivate the vaccine","I clean the toilet with bleach, it works! ",5,0,2116,2116,"",2116,"puffylemingtonII","maybesaydie",1
"So, when can I expect to die?","Can confirm, a countdown timer appeared above my head counting down till I die. I have at least 40 years given the average life expectancy. 

Also a  tall skeletal figure wearing a cloak & holding a scythe keeps pointing at me. ",1,0,991,991,"",991,"LilG1984","Lazy_boa",1
"How does one quantify the percentage of somethings evilness ?","Personal opinion means facts. Didn’t you know? Hmmm I guess you had your vaccinations, now you’re 100% evil ",3,0,2630,2630,"",2630,"Bionic_Dark_Knight","211XTD",1
"""Ukrainian death labs are bio engineering Covid and monkey pox.""","Oh yeah, Putin is a savior. These damn Ukrainians attacking their neighbour, murdering civilians, attacking hospitals and using illegal weaponry. Yeah, the Ukrainians. Sure.  
A hopefully obvious ",68,0,403,403,"",403,"iamghostling","maybesaydie",1
"Vazzed blood? Separate blood banks?","You know what they should really worry about? Vajazzled blood. Imagine getting a transfusion and thinking everything is just fine and come to find out it was from someone who had their yoni all dolled up with rhinestones. *shudders* ",4,0,1276,1276,"",1276,"candyassle","maybesaydie",1
"Beware the Black Goo Energy! (Reposted with redacted names)","She is really making some good sane arguments here. I always knew these vaccines weren’t good for my chakras and that they would infect the tesseract through interdenominational wormholes to the hell sphere. It all makes sense now.",4,0,562,562,"",562,"V4refugee","oeeom12",1
"US Life Expectancy Drops Slightly: r/conspiracy blames vaccines and not the pandemic which killed 1 million Americans","Or maybe the shit show that is American health care. Who knows? ",3,0,3554,3554,"",3554,"SirKlock2","maybesaydie",1
"""If vaccines are so great why aren't they mentioned in the bible?""","""Jesus says: get vaccinated idiots or you'll die from a rusty nail like me!"" New testament right at the back . ",7,0,4006,4006,"",4006,"LilG1984","maybesaydie",1
"""If vaccines are so great why aren't they mentioned in the bible?""","Jesus rode into Jerusalem on a donkey. He showed by example that we should only ride donkeys, not cars or bikes. ",3,0,4006,4006,"",4006,"kaths660","maybesaydie",1
"r/conspiracy is still angry about r/NoNewNormal","literally 1984 ",3,0,1938,1938,"",1938,"AltAccMia","maybesaydie",1
"Interactions with Antivaxxers-Post them here","This shit has ruined my mom.

My mom has always been a nutjob to say the least. I wasn't vaccinated growing up and got them all when I was an adult. She claimed back then the government was tracking us with microchips. For context, I was born in 1989. In high school I got my meningitis shot and she kicked me out for 3 days. Just crazy shit.


But despite all that she was a decent human.

Post covid she's turned into a psycho. Supporting the trucker movement to the point its all she talks about. Sending me insane articles about Trudeau. She called me saying he was going to take away her pension because she won't get the ""jab"". I told her that was a charter violation and not going to happen. She then went into some tirade about him and Chinese people that was absolutely insane.

Anyway, I now live in the US and called to tell her I am pregnant. I was dreading it but thought I had to. She cried with excitement. I told her my rules were that everyone had to be vaxxed (covid, TDAP, MMR) ETC. she lost her shit and said she will not be taking anything! She'd rather be dead in the streets then take that so she will never meet her grandchildren.

Then she went on some FB rant about what an idiot I am. How she didn't raise me to be so fucking stupid etc etc and how I'm prob going to miscarry anyway because I am vaxxed or my baby will be born deformed.

Safe to say I will not be talking to her for a very long time.


It's just so sad how covid and thus vaccine has made people cling on to any nutjob conspiracy theory possible rather....  And it seems to keep spiraling and getting worse and worse.",12,0,19,19,"",19,"buffylove","maybesaydie",0
"Interactions with Antivaxxers-Post them here","Our HSE lead is anti-vax. HSE stands for health and safety engineer. I can't even. Suffice to say, I don't trust a damn thing he says",15,0,19,19,"",19,"Flashmasterk","maybesaydie",0
"Interactions with Antivaxxers-Post them here","I was arguing with one and they sent me a link and said it was connected to how the government purposefully hides treatment like the one in the link as that one supposedly cured cancer

I opened the link and it was the most pyramid scheme thing I have ever seen. 6k for hotel shampoo bottles of honey looking liquid. I then immediately knew “Oh, you’re THAT brand of stupid!”",8,0,19,19,"",19,"BHMathers","maybesaydie",0
"Interactions with Antivaxxers-Post them here","I have an anti-vaxxer on tiktok saying that the FDA lost in court because they couldn't show any proof that vaccines are safe. I remember when this went around the internet, and I remember it was not true, but I don't remember exactly how it was untrue to argue back. Google will only show results for Covid vaccine info for pages and pages, and I've had no luck finding anything. Does anybody have any info to share?",11,0,19,19,"",19,"NoUdonut","maybesaydie",0
"Interactions with Antivaxxers-Post them here","I had been frequently challenging commenters and posters on r/scienceuncensored. A large part of their posts are antivaxx or Covid related. Most are nonsense and the few real studies that get posted usually draw completely different conclusions from the authors.",2,0,19,19,"",19,"Revolutionary-East80","maybesaydie",0
"Interactions with Antivaxxers-Post them here","I wish I could tell her I got my vax and got pregnant six months later and have a healthy 8 month old despite being type 1 diabetic lol",2,0,19,19,"",19,"KJackson1","maybesaydie",0
"You really can't get more dishonest than this","Steve Kirsch is a douchebag",247,0,853,853,"",853,"hngovr","maybesaydie",0
"You really can't get more dishonest than this","There’s a reason that virtually nobody today suffers from smallpox. It’s because the vaccine exists.",181,0,853,853,"",853,"iwanttobeacavediver","maybesaydie",0
"You really can't get more dishonest than this","Smallpox is literally extinct, aside from a handful of samples in deep freeze, and yet humans are still around. 

Wonder how that happened?",126,0,853,853,"",853,"AngelOfLight","maybesaydie",0
"You really can't get more dishonest than this","I think poor Steve is a little confused. 

However, that's understandable coming from this idiot.",158,0,853,853,"",853,"jmy578","maybesaydie",0
"You really can't get more dishonest than this","Can’t get any stupider, either. They stopped giving the vaccine because the disease is all but eradicated.",38,0,853,853,"",853,"bunnycupcakes","maybesaydie",0
"You really can't get more dishonest than this","That may be so in a few cases, but smallpox was much, much worse!",25,0,853,853,"",853,"MysticoftheWild","maybesaydie",0
"You really can't get more dishonest than this","A vaccine so deadly that the world population almost doubled since smallpox has been eradicated worldwide. Sure buddy, whatever.",19,0,853,853,"",853,"promote-to-pawn","maybesaydie",0
"You really can't get more dishonest than this","It was definitely created before anyone knew that the smallpox vaccine was deadly. Because that's still not something that there is evidence for.",51,0,853,853,"",853,"I_might_be_weasel","maybesaydie",0
"You really can't get more dishonest than this","I got that vaccine as a kid and still have the scar on my upper back. He looks old enough that he would have gotten it also. I'm positive it would have been recommended. I also remember the news that smallpox was wiped out worldwide in 1980.",15,0,853,853,"",853,"Tossing_Goblets","maybesaydie",0
"You really can't get more dishonest than this","r/TechnicallyTheTruth

Because, I mean, nobody ""figured out"" that the vaccine was deadly, so technically he's right",16,0,853,853,"",853,"AustSakuraKyzor","maybesaydie",0
"You really can't get more dishonest than this","But didnt the vaccine eradicate smallpox? How do they believe what they believe when people are alive today that saw first hand smallpox disappearing when the vaccine was introduced?",8,0,853,853,"",853,"guybranciforti","maybesaydie",0
"You really can't get more dishonest than this","He has a very punchable face.",8,0,853,853,"",853,"DamnMombies","maybesaydie",0
"You really can't get more dishonest than this","Steve Kirsch has no depth limit to his dishonesty.",6,0,853,853,"",853,"awithonelison","maybesaydie",0
"You really can't get more dishonest than this","Is this the guy that offered someone 10k to take off their mask",4,0,853,853,"",853,"mrubuto22","maybesaydie",0
"You really can't get more dishonest than this","It’s too dangerous because it made stupid people live longer.",4,0,853,853,"",853,"PsychoMouse","maybesaydie",0
"You really can't get more dishonest than this","Wait! Am I dead and I don't know it? Could it be that I'm dead, along with every person I attended school with?",3,0,853,853,"",853,"PNW4theWin","maybesaydie",0
"You really can't get more dishonest than this","They were still giving the smallpox vaccine to military members were going to deploy in the mid-2000s. Wtf is this dude on about?",3,0,853,853,"",853,"AnnaBananner82","maybesaydie",0
"You really can't get more dishonest than this","This guy looks like a grade-A schmuck",2,0,853,853,"",853,"Koolaidolio","maybesaydie",0
"You really can't get more dishonest than this","Who is this doofus, and do I have to care?",2,0,853,853,"",853,"Someoneoverthere42","maybesaydie",0
"You really can't get more dishonest than this","The guy has one of those faces where you instinctively know not to trust anything that comes out of his mouth, no wonder he started spouting conspiracy shit, it was a self fulfilling prophecy",2,0,853,853,"",853,"TB2k17","maybesaydie",0
"You really can't get more dishonest than this","People don't get it anymore because it's been eliminated and it is no longer necessary for people to get it",2,0,853,853,"",853,"dtb1987","maybesaydie",0
"You really can't get more dishonest than this","Or because smallpox vaccination eliminated smallpox.",2,0,853,853,"",853,"ddr1ver","maybesaydie",0
"You really can't get more dishonest than this","What a POS.",2,0,853,853,"",853,"CQU617","maybesaydie",0
"You really can't get more dishonest than this","What a lie.",1,0,853,853,"",853,"Zabes55","maybesaydie",0
"My parents are telling people on Facebook to use and ingest borax to remove ""radiation, pesticides, parasite, vaccine."". I just can't anymore.","They know we're vaccinated so they tried getting us to take a bath in borax water to ""deactivate the vaccine"" and the baking soda to""deactivate the nanobots.  Gtfo.  I haven't spoken to them since.   

https://imgpile.com/i/hPu7bb    
https://imgpile.com/i/hPuNl3",103,0,237,237,"",237,"sierrabravo1984","sierrabravo1984",0
"My parents are telling people on Facebook to use and ingest borax to remove ""radiation, pesticides, parasite, vaccine."". I just can't anymore.","I think they are just saying to bathe in it.  

But also, “Nanotechnology removal” it is so much easier to make shit up than it is to prove them wrong.  I’ll just start the rumour that these nano bots are powered by whatever toxin they are ingesting and that ingesting anything to remove nanotechnology will just power the nano bots longer.",48,0,237,237,"",237,"Mindweird","sierrabravo1984",0
"My parents are telling people on Facebook to use and ingest borax to remove ""radiation, pesticides, parasite, vaccine."". I just can't anymore.","This sounds incredibly dangerous.",21,0,237,237,"",237,"anonymousbwmb","sierrabravo1984",0
"My parents are telling people on Facebook to use and ingest borax to remove ""radiation, pesticides, parasite, vaccine."". I just can't anymore.","Detoxing radiation? That's fucking hilarious.

Editing to add: this reminds me of those anti-radiation bracelets n stuff you can buy on Amazon. That shit is dangerous and actually radioactive. Never buy anything that claims to clear out radiation.",20,0,237,237,"",237,"groundzer0s","sierrabravo1984",0
"My parents are telling people on Facebook to use and ingest borax to remove ""radiation, pesticides, parasite, vaccine."". I just can't anymore.","I think it’s time to send your parents to a nursing home.",19,0,237,237,"",237,"itlllastlonger32","sierrabravo1984",0
"My parents are telling people on Facebook to use and ingest borax to remove ""radiation, pesticides, parasite, vaccine."". I just can't anymore.","It's amazing that they're scared of a half a ml of vaccine, but they'll drink quarts of laundry products.",11,0,237,237,"",237,"awithonelison","sierrabravo1984",0
"My parents are telling people on Facebook to use and ingest borax to remove ""radiation, pesticides, parasite, vaccine."". I just can't anymore.","It's not an Aztec secret if they tell everybody about it!",10,0,237,237,"",237,"Informal_Drawing","sierrabravo1984",0
"My parents are telling people on Facebook to use and ingest borax to remove ""radiation, pesticides, parasite, vaccine."". I just can't anymore.","mrw bill gates and his nanobots get defeated by Aztec secrets.",7,0,237,237,"",237,"golddilockk","sierrabravo1984",0
"My parents are telling people on Facebook to use and ingest borax to remove ""radiation, pesticides, parasite, vaccine."". I just can't anymore.","Any hope this is actually an April Fool's day post?  Please?",3,0,237,237,"",237,"TheJollyHermit","sierrabravo1984",0
"My parents are telling people on Facebook to use and ingest borax to remove ""radiation, pesticides, parasite, vaccine."". I just can't anymore.","What no essential oils?",3,0,237,237,"",237,"blushfanatic","sierrabravo1984",0
"My parents are telling people on Facebook to use and ingest borax to remove ""radiation, pesticides, parasite, vaccine."". I just can't anymore.","Ivermectin is best applied as a suppository, filled up inside a hollowed lightbulb with the screw end inserted last.  


Do not apply lubrication as this will affects it's potency.,",4,0,237,237,"",237,"Kuldiin","sierrabravo1984",0
"My parents are telling people on Facebook to use and ingest borax to remove ""radiation, pesticides, parasite, vaccine."". I just can't anymore.","How did you survived living with them?",2,0,237,237,"",237,"4pigeons","sierrabravo1984",0
"My parents are telling people on Facebook to use and ingest borax to remove ""radiation, pesticides, parasite, vaccine."". I just can't anymore.","Natural Selection? 🤷‍♀️",2,0,237,237,"",237,"CBPSader","sierrabravo1984",0
"My parents are telling people on Facebook to use and ingest borax to remove ""radiation, pesticides, parasite, vaccine."". I just can't anymore.","Then grow a spine and call the FBI.",2,0,237,237,"",237,"TheBonePoet","sierrabravo1984",0
"My parents are telling people on Facebook to use and ingest borax to remove ""radiation, pesticides, parasite, vaccine."". I just can't anymore.","Sheesh r/insaneparents",1,0,237,237,"",237,"916Hajmo","sierrabravo1984",0
"If only vaccines were sexually transmitted… If only!","I would troll that guy so hard. I hope that is what the commenter is doing lol",20,0,93,93,"“…they went blue after encounter”?",93,"scarlozzi","RenRen9000",0
"If only vaccines were sexually transmitted… If only!","Oh FFS…these people are so delusional it hurts.",11,0,93,93,"“…they went blue after encounter”?",93,"Electrical_Life_5083","RenRen9000",0
"If only vaccines were sexually transmitted… If only!","""my boyfriend said I got chlamydia from riding my tractor in my swimsuit.""

Jerry Seinfeld: ""and I'm outta here, good night everybody""",11,0,93,93,"“…they went blue after encounter”?",93,"Sasquatch1729","RenRen9000",0
"If only vaccines were sexually transmitted… If only!","God dammit not the swollen balls again.",4,0,93,93,"“…they went blue after encounter”?",93,"Misty_Milo","RenRen9000",0
"If only vaccines were sexually transmitted… If only!","Guys has had 

Ok that’s enough doctor",2,0,93,93,"“…they went blue after encounter”?",93,"Johncamp28","RenRen9000",0
"If only vaccines were sexually transmitted… If only!","My husband and I have multiple “jabs.” Side effects? Lots of fun.",2,0,93,93,"“…they went blue after encounter”?",93,"MaddyandOwensMom","RenRen9000",0
"If only vaccines were sexually transmitted… If only!","Pregnancy.",1,0,93,93,"“…they went blue after encounter”?",93,"Zabes55","RenRen9000",0
"TMW they respond to being called out for posting BS anti-vax tropes with yet another BS anti-vax trope","I'm so angry about these uneducated idiots posting things like this.

It is a vaccine.

The definition of a vaccine is something that exposes you to a piece of some pathogen, either by exposing you to a protein on its surface (as the COVID vaccine does), by exposing you to a killed or weakened version of the pathogen, or some other method.

Even if it weren't a vaccine, does it matter? It still is very effective at preventing disease.",12,0,62,62,"",62,"ChickenSpaceProgram","PirateJohn75",0
"Monkeyshines","This person has no idea what she’s talking about. That’s not what Rh factor means.",889,0,2046,2046,"",2046,"PeterParker72","maybesaydie",0
"Monkeyshines","I'm pretty sure positive blood types existed before anything about genetics was known.",220,0,2046,2046,"",2046,"I_might_be_weasel","maybesaydie",0
