"Title","Body","Comment_Ups","Comment_Downs","Post_Ups","Post_Downs","Parent_Post","Score","Comment_Author","Post_Author","Sarcastic"
"You really can't get more dishonest than this","It was so deadly that there's virtually nobody with smallpox alive today! ",1,0,853,853,"",853,"jbwhite42","maybesaydie",1
"This.","Well of course you'd say that... ",53,0,1361,1361,"",1361,"Moneia","North_Recognition199",1
"This.","Ok, I re-evaluated my views and came to the conclusion that you are part of the conspiracy, too... ",46,0,1361,1361,"",1361,"BranWafr","North_Recognition199",1
"Antivax Doctor blames death of 67 yr old with congenital heart problems on mRNA vaccines.","The covid vaccines must have been around for at least a century and secretly injected into the populace, since heart disease has been a leading cause of death in developed countries and covid vaccines cause them ",10,0,99,99,"Paul O’Grady was a much loved British entertainer and died today after surviving 2 previous heart attacks, a family history of heart problems and decades of heavy smoking. Antivax doctor still somehow has not been struck off.",99,"sonicpool69","majesticfloofiness",1
"From the hospital room of a covid patient","You'd think they would at least realise covid is a real threat. 

I've had it twice with mild symptoms from being triple vaxxed.  The abuse healthcare workers got from the pandemic was awful. 

On the plus side that big juicy cheque from big pharma is going your way! ",2,0,4740,4740,"",4740,"LilG1984","maybesaydie",1
"Kansas lawmaker asks for security during anti-vaccination bill hearing: ‘I don’t feel comfortable’: would require employers to grant exemptions from vaccine requirements without questioning the need for the exemption","Security staff doesn't prevent against attacks. Sometimes security staff causes MORE harm than good! Studies show that the presence of security staff leads to more incidents.

#",96,0,735,735,"",735,"CosmicSweets","shallah",1
"Blaming the vaccine even though the screenshot says strep infection right in it","Well duh!! Obviously the vaccine MADE HIM get strep!! 

Heavy ",94,0,1971,1971,"",1971,"TheAikiTessen","PirateJohn75",1
"Blaming the vaccine even though the screenshot says strep infection right in it","Obviously it's the vaccine's fault if he dies. I mean, 100% of vaccinated people have died or will die, so the evil vaccine is clearly causing tons of deaths!

",34,0,1971,1971,"",1971,"KYZ123","PirateJohn75",1
"Blaming the vaccine even though the screenshot says strep infection right in it","I had a stomach virus last year. Must be because of the covid vaccine as well ",1,0,1971,1971,"",1971,"sonicpool69","PirateJohn75",1
"Started seeing this ad and similar on reddit today. Wtf?","Mother drank water during pregnancy?

Child has autism?

If both are yes, you could be entitled to compensation",6,0,1445,1445,"",1445,"Irish_Wildling","thatbetchkitana",1
"So choice for an individual’s life that doesn’t affect me is bad because we need to save the fetuses and choice that affects the health of living people also bad? Do I have that right?","Well pregnancy is totally a communicable disease sooo ",10,0,211,211,"",211,"chloe1919","runawaytardis",1
"r/conspiracy thinks that guns will help end the next pandemic","Well, of course!  The reason it stayed so long this time around is because people didn’t shoot it enough! ",2,0,769,769,"",769,"No_Atmosphere2677","maybesaydie",1
"r/conspiracy thinks that guns will help end the next pandemic","Yeah, because one stupid, untrained American with a gun could TOTALLY fight the US if need be ",2,0,769,769,"",769,"Comrade_Jessica","maybesaydie",1
"r/conspiracy thinks that guns will help end the next pandemic","Ah one of my favorites showing up, the dreaded FEMA camps. They're always about to be deployed but never seem to happen. 

Guns can definitely help stop the pandemic because you can just shoot the virus! ",2,0,769,769,"",769,"Anastrace","maybesaydie",1
"Human Reproduction: antivaxxer version","See, this explains why all the Hollywood shows set in the medieval era never deal with periods. It’s because they never happened back then, makes so much sense now! ",18,0,2257,2257,"",2257,"iAmHism","maybesaydie",1
"Apparently a few vaccines are “real”","Diphtheria is absolutely a laugh a minute. That's why we vaccinate against it. Because all that dying is *too much* fun for the kiddies. ",17,0,596,596,"",596,"i_raise_anarchists","Demonking3343",1
"r/conspiracy believes that ""millions of people would still be alive if we had listened to Trump [about covid.]""","So many people die in hospitals that they have to build morgues there.

",39,0,662,662,"",662,"coffeewithalex","maybesaydie",1
"Stew is at it again! This time you have to read it.","So we didn’t need the vasectomy after all? ",2,0,1518,1518,"",1518,"Theobat","Ranger_McFriendlier",1
"Stew is at it again! This time you have to read it.","Can confirm. My dick rotted off. For sure. It's definitely real. And a thing.

",1,0,1518,1518,"",1518,"Starkiller006","Ranger_McFriendlier",1
"That's not how any of this works","So I’ve been doing countless sets of vitals for nothing this whole time? Gotta get this app! ",2,0,274,274,"",274,"NerdyNurseKat","maybesaydie",1
"I think r/iamatotalpieceofshit would work here too","I can't tell if they're being serious ",9,0,93,93,"",93,"Competitive_Papaya_8","greenlysnooker",1
"There is no such thing as a virus says r/conspiracy","Lawsuits are not real, either. Do not hire lawyers. All you need is read them the Constitution, when you get sued. ",22,0,1263,1263,"",1263,"florinandrei","maybesaydie",1
"Cured?","Vaccinating your children is drugging them, but secretly injecting them with unapproved drugs is all good ",8,0,525,525,"",525,"deedeevinee","maybesaydie",1
"""I'm not often wrong"" says antivaxxer who's afraid of LED lights","5G with no antenna, that must be something new. ",3,0,1774,1774,"",1774,"dover_oxide","maybesaydie",1
"Not Being Vaxxed Has Now Become A Dating Requirement For Some People","Yeah I bet they received 0 vaccines in their entire life ",7,0,319,319,"",319,"Ratmatazz","LJ_909",1
"Tom Sizemore suffered a brain aneurysm. Of, anti-vaxxers are blaming the COVID vax. The babbling continues....","I hear death by old age is one of those 1600 side effects ",11,0,98,98,"",98,"Danibanz","jmy578",1
"Ivermectin can cure cancer now","i’ll tell both my parents!! also my 2 dead grandparents! maybe it can cure them from death? just double it?? ",4,0,214,214,"",214,"Alisseswap","champdo",1
"From my Facebook Feed Today","What would they say if we told them it happened before 2020, my kid born a few years before that held her head up at the hospital and slept on her side on day 2 in the hospital. The nurses say it happens. 

But maybe it was the ""jabs"" I got growing up  ",7,0,64,64,"",64,"Mina328","amazonallie",1
"I don’t think they understand Biology. Found at my local farmers market.","What did Myrna do? 😭 ",29,0,2199,2199,"",2199,"kittykatkb","ispeakjew2",1
"Couldn't possibly be the thousands of pounds of lung-corroding acid it was carrying. Nah, definitely vaccines.","You guys didn't know.

There were zero deaths before the Vaccine and now look at all the people dropping.

Isn't that interesting. 🤔


Very hard ",3,0,1553,1553,"",1553,"SnooStories8217","Supaleenate",1
"Grandma's in a better place. A place where there are no antivaxxers.","My friend got the vaccine a year ago and today she passed on at the age of only 36. She was always a healthy woman, at least before she got diagnosed with terminal cancer six months ago, but thats beside the point. ",2,0,1814,1814,"",1814,"Rainbow_Rae","maybesaydie",1
"Antivax doctor tells his followers to nebulize Hydrogen Peroxide - DO NOT DO THIS! IT CAN KILL YOU.","Ive also head that nebulizing chlorine gas is great for clearing out the sinuses! ",8,0,1829,1829,"",1829,"nightcana","TunnelTuba",1
"Antivax doctor tells his followers to nebulize Hydrogen Peroxide - DO NOT DO THIS! IT CAN KILL YOU.","I mean... If you kill all the hosts, the virus will die too. ",3,0,1829,1829,"",1829,"Alexis2552","TunnelTuba",1
"""Vaccines made my white cousin marry a black man""","Wait a second.... ECZEMA? Well, cancel my boosters. ",25,0,1221,1221,"",1221,"FlaxFox","maybesaydie",1
"""Vaccines made my white cousin marry a black man""","I think they forgot the /s. I hope they forgot the ",2,0,1221,1221,"",1221,"fuparrante","maybesaydie",1
"They're obsessed with this ""covid jab = thicker blood"" nonsense.","Did s/he made sure they put ""unjabbed"" on the bag? That's extremely important! ",2,0,1143,1143,"",1143,"CSI_Tech_Dept","FKFnz",1
"Updated: These people really don’t like being called out. I’m in Green.","Get a brain, OP ",1,0,1161,1161,"",1161,"upsettispaghetti7","SnooGoats1557",1
"I know someone who never got vaxxed and their fine.","""I know a whole community of people who never wear their seatbelts and none of them have ever died.  Seatbelts are a hoax.""

",3,0,1445,1445,"",1445,"MegaSillyBean","SnooGoats1557",1
"Side effect: Low iq","I wasn't aware that sperm could be vaxxed. ",21,0,476,476,"",476,"joooooooles","Fearless-Purpose-133",1
"A study of individuals with heart failure, showed that unvaccinated people were amongst the highest death rate.","They have heart failure because they come in contact with the jabbed who shed their spike proteins. This is murder, arrest all the jabbed!!!

",7,0,94,94,"",94,"unicyclecopilot","TunnelTuba",1
"I wish!","The vaccinated are shedding it, and giving everyone AIDS or whatever anyway.  so you're getting exposed everytime you walk outside. 

",9,0,1040,1040,"",1040,"Nail_Biterr","JordanAsquith",1
"It's simple, really. Drinking your own urine will heal you from the vaxx","Hm. It’s almost like the body is getting rid of all the waste products, toxins, and harmful substances that run through our systems by excreting them in our pee

No. Can’t be right
Definitely should drink the stuff our body already said it didn’t want ",2,0,160,160,"",160,"Small_beann","Tossing_Goblets",1
"Found this in r/oddly specific, but it seemed to fit here","Well, isn't he a catch  ",1,0,177,177,"I love the irony of ""your to dumb"".",177,"Confident_Fortune_32","GlobularLobule",1
"Annie Wersching dies of cancer, and right on cue: Here come the Ghoulgulls","I miss the days when people didn't die.  ",2,0,148,148,"",148,"bishopsbranch56","TunnelTuba",1
"A true hero…","Yes because medical fraud is definitely not a crime ",377,0,3356,3356,"",3356,"Imperator424","j_hamilton20",1
"A true hero…","Yeah he’s such a great example for the frontrunner of your movement definitely not a grifter at all ",5,0,3356,3356,"",3356,"ophelias_tragedy","j_hamilton20",1
"A true hero…","ah yes, all my heroes are also in jail for mal praxis",1,0,3356,3356,"",3356,"dalvean88","j_hamilton20",1
"The stupid. It hurts.","Time to start marketing eukaryotic ribosome inhibitors as mRNA protectors. Surely blocking all translation is worth the peace of mind of not having any mischievous mRNA exacting its plans ",2,0,2018,2018,"",2018,"MrMetastable","Ranger_McFriendlier",1
"Dr Drew: of course he's an antivaxxer","What's that? A known massive POS being a massive POS? Say it ain't so....",2,0,1609,1609,"",1609,"UnLuckyKenTucky","maybesaydie",1
"Doing IVF To avoid altering your child’s DNA?","Because no child was ever born with a defect prior to covid vaccines ",3,0,24,24,"",24,"stefani65","vrphotosguy55",1
"Ghoul Steve Kirsch, Anti-Vaxxer who harasses people with his constant demand for dishonest ""debates"" making fun of a doctor and Pro-Vax advocate who died at 77 years old.","Funny how they use the phrase “died suddenly in her sleep” instead of the usual “died peacefully in her sleep” - I wonder why??? ",429,0,1861,1861,"",1861,"pleasantstusk","Tenebra99",1
"Ghoul Steve Kirsch, Anti-Vaxxer who harasses people with his constant demand for dishonest ""debates"" making fun of a doctor and Pro-Vax advocate who died at 77 years old.","Yeah, who would not want to debate someone who can't stay away from disgusting attacks for a hot second *about a dead person*? ",187,0,1861,1861,"",1861,"ChristieFox","Tenebra99",1
"Ghoul Steve Kirsch, Anti-Vaxxer who harasses people with his constant demand for dishonest ""debates"" making fun of a doctor and Pro-Vax advocate who died at 77 years old.","Now this was a wholesome tweet.

",3,0,1861,1861,"",1861,"lysol90","Tenebra99",1
"It’s not like we didn’t say this was a possibility","What a shame ",1,0,111,111,"",111,"bangobingoo","maybesaydie",1
"It’s TRUE.","But what about the millions upon millions of young, healthy people (athletes, even) suddenly dying of heart problems? 

",6,0,3168,3168,"",3168,"SQLDave","EugeneWong318",1
"More from FIL.","Ah yes! Because we all know that ppl never get sick or injured after a visit from their doctor",2,0,1476,1476,"",1476,"xTimeKey","Bellman276",1
"Why are antivaxxers like this? Why do they spread lies? She hersel debunked the rumors about having a CoVax induced stroke. She knows what the doctor assessed.","My first thought was that she was having a low blood sugar episode - something that of course never happened before the release of COVID vaccines ",1,0,19,19,"",19,"TsuDhoNimh2","mothsoup",1
"My FIL is deep down the rabbit-hole! 🙄","So Early inheritance coming? ",2,0,1506,1506,"",1506,"CanadianPanda76","Bellman276",1
"My FIL is deep down the rabbit-hole! 🙄","Well I'm still waiting for these X-Men powers since I'm triple vaxxed my DNA has obviously mutated. ",2,0,1506,1506,"",1506,"LilG1984","Bellman276",1
"r/conspiracy hysteria and disinformation : ""In 100 years no one will have an immune system. Vaccines will destroy them""","If only vaccines were around over a 100 years ago.  Then we'd already know.  ",3,0,1422,1422,"",1422,"Bunny_Feet","maybesaydie",1
"r/conspiracy hysteria and disinformation : ""In 100 years no one will have an immune system. Vaccines will destroy them""","I got sick for the first time in five years with a non Covid upper resp infection, checkmate vaxx sheep. ",3,0,1422,1422,"",1422,"Da_Space","maybesaydie",1
"“tHaT’s wHy pEoPlE AsK qUeStIonS”","Ah yes, as we all know, heart attacks in teen athletes never happened until the covid vaxx! ",9,0,2115,2115,"",2115,"xTimeKey","dyingdeadenough",1
"Didn't take long","The defibrillator wasn’t invented till 2021.",2,0,1731,1731,"",1731,"V4refugee","0604050606",1
"Just wow","Everyone who has ever died/had an injury since the vaccine rollouts is *obviously* cause and effect 


Obligatory ",2,0,1928,1928,"",1928,"Roadkilla86","chunkopunk",1
"Just wow","I have a bridge to sell you ",1,0,1928,1928,"",1928,"Snoo42225","chunkopunk",1
"Sounds yummy","No wonder they taste so good !! ",6,0,2808,2808,"",2808,"FullyVaxxedswole","maybesaydie",1
"Antivaxxers are ghouls","100% of people who have had heart attacks, have drank water some time in the previous 12 hours before their heart attack. How come no one is talking about the connection between drinking water and heart attacks ",38,0,73,73,"",73,"Irish_Wildling","Suicidalsidekick",1
"If these people were my parents I would never speak to them again","It’s really funny. We could reduce the cases of covid if we don’t test. People stop testing positive when they don’t test so we should abolish covid tests and make them illegal. ",2,0,2198,2198,"",2198,"Designer_Captain_498","maybesaydie",1
"More than 80 Ohio children infected in measles outbreak, most unvaccinated","So some were vaccinated, proves that vaccines don't work!1!2! ",12,0,75,75,"",75,"Bojacketamine","BlankVerse",1
"Delusional","""It tastes funny too"" ",2,0,1763,1763,"",1763,"ancient_mariner63","maybesaydie",1
"Delusional","My dad got me a new knife for Christmas... I already cut myself, can confirm my blood was basically just black sludge ",1,0,1763,1763,"",1763,"Accomplished_Crew630","maybesaydie",1
"Microchip? Hell no! Neural link? Hell yes!","Open source software can’t be bad, because it’s natural and organic. ",2,0,4006,4006,"",4006,"trent58","maybesaydie",1
"""You can't make this up""","Next will be Jewish 6G. ",1,0,1959,1959,"",1959,"Cactus-Badger","maybesaydie",1
"I don't know what to say anymore","Clearly it's time for DeSantis to convene a grand jury to investigate. ",1,0,226,226,"",226,"Fire_Doc2017","futuristicinaugurate",1
"Stupidity Singularity","Oh!

Got it! Just shave all my body hair and I am immune to covid!

Knew I didn't need that vaccine.

",2,0,22,22,"",22,"Nettykitty11","maybesaydie",1
"""Suddenly Died""","Oh yes Facebook the most  Reliable search engine and source of info ",7,0,93,93,"",93,"MLPLoneWolf","maybesaydie",1
"seems like a group of totally well-adjusted and normal individuals","That’s why it’s called messenger rna. It’s all about sending messages between people, AOL instant messenger was when this rna scourge began 



",18,0,1176,1176,"",1176,"cryingsilently","myerhees",1
"seems like a group of totally well-adjusted and normal individuals","Good call on not going to family gatherings. It’s not worth the risk. Should probably refrain from calling too. I’ve heard that the 5g in the 🥕 can alter your DNA through the phone. Best to just cut all contact with your 🥕 relatives.",11,0,1176,1176,"",1176,"V4refugee","myerhees",1
"Elon allowing anti vax bs back on twitter? Not surprised.","He’ll be the first person to get it. But YOU totally shouldn’t because Soros and Gates will TRACK you. ",9,0,1896,1896,"",1896,"Calkky","sonicpool69",1
"Wow a total 8 months of not being sick? That is proof we don't need vaccines","I allow my kids to play with loaded grenades, and they never figured out that they could pull the pin, so they must absolutely be safe.

",3,0,4867,4867,"",4867,"PKHacker1337","muhacinco",1
"Anti-Vaxxers Blame RSV Epidemic On Crisis Actors, Again | Crooks and Liars","I didn’t know babies could act so well! ",2,0,899,899,"",899,"sonicpool69","shallah",1
"Oh #diedsuddenly is trending, let’s see what antivaxxers have to say… oh no","I remember the time before Covid where no one ever died. In fact, I am 200 years old

",6,0,1414,1414,"",1414,"lustforwine","xTimeKey",1
"Antivaxxer is getting a divorce","I simply cannot believe someone who is so adamantly anti-vaxx would have a pro-science spouse that finally got fed up with their shit. ",9,0,3007,3007,"",3007,"Nail_Biterr","maybesaydie",1
"""You probably caught the gay from childhood vaccines""","Ive received so many vaccines in my life and yet I’m not gay! I feel scammed! ",2,0,3388,3388,"",3388,"sonicpool69","maybesaydie",1
"The good old ""shedding"" chestnut again.","So I guess the real corona is the vaccines we made along the way then. TIL.

I mean, didn't they start testing them as early as in March of 2020? How have I not seen this before? It's so obvious. ",1,0,1386,1386,"",1386,"SBaL88","FKFnz",1
"Matthew_McConaughey's wife Camilla injured in a fall: The vaccines did it!","Vaccine makes the spine weaker! ",3,0,1112,1112,"",1112,"WhatsInAName-123","maybesaydie",1
"Matthew_McConaughey's wife Camilla injured in a fall: The vaccines did it!","Well at least with the vaccine you don't need a [halo neck brace](https://upload.wikimedia.org/wikipedia/commons/a/a2/Halo_Brace.png) screws to your skull after falling down stairs! ",2,0,1112,1112,"",1112,"Jim_SD","maybesaydie",1
"""The vaccine is installing extra chromosomes!""","Wow cool! My biochemistry and molecular genetics classes never told me that mRNA contains an entire chromosome! /s /s ",1,0,1875,1875,"",1875,"SylasDevale","maybesaydie",1
"""Vaccinated people make me cough""","Weirdly, their symptoms only appear after they've been made aware of the fact that someone around them is vaccinated. Must be some autoimmunity thing then, for sure!

^^",86,0,2412,2412,"",2412,"iamghostling","maybesaydie",1
"""Vaccinated people make me cough""","Good I was beginning to think these vaccines weren't working. ",2,0,2412,2412,"",2412,"endangeredlime","maybesaydie",1
"Anti-Vaxxers - blaming everything on vaccines, even if the bodies aren't even cold yet.","No aeroplane accidents ever occurred until after vaccines existed. That's just a scientific fact.

Wake up, sheeple! ",6,0,2996,2996,"",2996,"Bortron86","Tenebra99",1
"Anti-Vaxxers - blaming everything on vaccines, even if the bodies aren't even cold yet.","We all know the only reasons the planes crashed into each other is because of the microchips that the government puts into us gave off 5G energy that caused this to happen. The vaccines have the microchips in them. ",2,0,2996,2996,"",2996,"dreldrift","Tenebra99",1
"Oh yes they are","Jokes on us. Because not only are the unvaccinated not dying, but us libturdz are dropping dead every time the Soros chips are activated. Not to mention the fact that our blood has turned to tar. ",2,0,407,407,"",407,"Calkky","maybesaydie",1
"She’s not going to like the advice given.","Why is she not going to a chiropractor? ",1,0,737,737,"",737,"Zealousideal_Ebb6177","cornflakescornflakes",1
"I think r/iamatotalpieceofshit would work here too","Hmm. 

Unvaccinated god-daughter bought measles home to her six-week old baby sister, the infection caused a 100ml abscess in her brain (her skull at the time held about 400ml). She stopped breathing. Thankfully, CPR and the ambulance techs managed enough basic life support to get her to a hospital. 

Six brain surgeries over an 8-month period, altered for another five-years while she re-wired, and ~60% permanent vision loss.

Mum did not learn the lesson and buried herself in anti-vax nonsense.

Measles is harmless ",303,0,2409,2409,"",2409,"epsilona01","rodjarc",1
"I think r/iamatotalpieceofshit would work here too","ah, yes, the five great evils. transgenderism, homosexuality, autism, eczema and allergies. pray you don’t meet a trans gay guy with autism, allergies and a skin condition. the most evil of them all. ",3,0,2409,2409,"",2409,"confusion_jpeg","rodjarc",1
"Anti-Vaxx looks for help","I’ve heard letting a dog lick you helps with that.  ",1,0,2447,2447,"",2447,"RabidRoosters","GetOffMyLawn_",1
"Yes, the plague rats are trying to pin Aaron Carter's death on the vaccine. And no, they didn't take 2 minutes to ""Do their own research""","Perhaps you sheep have never noticed how close the word Vaccinated is with....wait for it...!


*assassinated*!!!! 


",2,0,496,496,"",496,"UncleMalky","TunnelTuba",1
"Of course, all Sudden Cardiac Arrests must be vaccine related, it can't be anything genetic or the virus, it must be vaccines.","Trust the ophthalmologist in areas he doesn't understand, he's got no agenda whatsoever ",3,0,1086,1086,"",1086,"Anastrace","Tenebra99",1
"On the day of her vaccine, before she even got the vaccine. Anti-Vaxxers don't care, they'll exploit it anyway.","She died from having the disease? Yeah, total *anti*\-vaxx argument ",83,0,3260,3260,"",3260,"ChristieFox","Tenebra99",1
"On the day of her vaccine, before she even got the vaccine. Anti-Vaxxers don't care, they'll exploit it anyway.","She was near it and the magnetism in it killed her. ",1,0,3260,3260,"",3260,"romulusnr","Tenebra99",1
"Raise your hand if you suffered from demonic entities after vaccination!","Had to bat away the satanic temptresses while I was taking a dump earlier, wish I'd never gotten the jab! ",3,0,1969,1969,"",1969,"LongAndShortOfIt888","truckoffvancouver",1
"antivaxxers lie","Then what is the 5G my body gets for after I get the shots? 

",4,0,26,26,"",26,"ScooButt","maybesaydie",1
"What happened? You never paid attention.","Back in my day, only the ones who where born old and sick died from heart complications

&#x200B;

",3,0,109,109,"",109,"RosariusAU","Tenebra99",1
"What stage are y'all on?","Apparently I should be suffering basically of these things right now, never knew I was currently undergoing heart failure, strokes and blood clots ",3,0,1934,1934,"",1934,"Class_444_SWR","Lazy_boa",1
"What stage are y'all on?","Man, it's a great thing covid doesn't give you myocarditis. ",2,0,1934,1934,"",1934,"midnitte","Lazy_boa",1
"Three Years to Live","Hmmm … two weeks to live from a COVID infection at the beginning of the pandemic or an extra 3 years to live from taking a vaccine in early 2021? Not an easy decision at all. ",1,0,1606,1606,"",1606,"Fuhdawin","maybesaydie",1
"Three Years to Live","If I was them I would be looking for the Aedes albopictus mosquitos (the ankle-biting mosquitoes.

Gates for sure already designed them to spread the vaccine. ",1,0,1606,1606,"",1606,"CSI_Tech_Dept","maybesaydie",1
"Leave it to anti-vaxxers to not understand why countries that don't speak English aren't googling English phrases.","Maybe he can type it in with an accent and get the results he's looking for. ",8,0,3383,3383,"",3383,"Calkky","JordanAsquith",1
"Idiot claims that Canadians are being secretly vaccinated during surgery","""It's been reported...""  

By who? Who is reporting this? Show me a news report on which people have followed up and have actual factual evidence for this.  It's been reported so there must be a paper trail. Right? Riiiight??? ",16,0,94,94,"",94,"IronhideD","maybesaydie",1
"""Pureblood mates""","Hmmm… how many cows do they come with?  My three year old grandson won’t accept anyone with a dowry of less than four cows ",6,0,2219,2219,"",2219,"tothe_peter-copter","maybesaydie",1
"Some people just don’t get it","What's that? Unvaccinated people not allowed to cross borders during a pandemic? Truly outrageous ",9,0,58,58,"",58,"Expensive-Pea1963","GetOffMyLawn_",1
"They're still saying the most ridiculous things","Rumor has it that snake oil can remove mRNA. ",3,0,3027,3027,"",3027,"alexgriz127","maybesaydie",1
"They're still saying the most ridiculous things","THATS IT, I'm opening up shop to sell homeopathic tinctures to remove toxins after vaccination and exposure to vaccine ""shedding"". ",1,0,3027,3027,"",3027,"SickViking","maybesaydie",1
