"Title","Body","Comment_Ups","Comment_Downs","Post_Ups","Post_Downs","Parent_Post","Score","Comment_Author","Post_Author","Sarcastic"
"Monkeyshines","It's called Rhesus factor because it was first discovered in Rhesus monkeys, not because humans got it from monkeys.",173,0,2046,2046,"",2046,"notreallylucy","maybesaydie",0
"Monkeyshines","I look forward to reading her PhD thesis on the subject.

/s

Edit word.",250,0,2046,2046,"",2046,"grue2000","maybesaydie",0
"Monkeyshines","How indescribably, yet confidently stupid.",79,0,2046,2046,"",2046,"Present_End_6886","maybesaydie",0
"Monkeyshines","r/confidentlyincorrect",70,0,2046,2046,"",2046,"JoshuaBurg","maybesaydie",0
"Monkeyshines","Oh look. Anti-vaxxers are also young earth creationist. Dumbassoury all around. I also love how they just make shit up.",58,0,2046,2046,"",2046,"scarlozzi","maybesaydie",0
"Monkeyshines","Are you telling me that a million years ago big pharma put monkey blood in me? I DO NOT CONSENT",39,0,2046,2046,"",2046,"nobadhotdog","maybesaydie",0
"Monkeyshines","100% of humans have ape blood because humans are apes.",34,0,2046,2046,"",2046,"uwillnotgotospace","maybesaydie",0
"Monkeyshines","These people are so goddam dumb about patently wrong, basic science it's not only painful it's fuckin' deadly.",19,0,2046,2046,"",2046,"Corsaer","maybesaydie",0
"Monkeyshines","I mean I've always suspected that deranged conspiracy theorists evolved from unintelligent pond scum, but sadly science disagrees with me and says that they too also evolved from (great) apes.",17,0,2046,2046,"",2046,"translove228","maybesaydie",0
"Monkeyshines","From my understanding, even evolution deniers don't use Rh types in arguments. Only ""race realists"" do. In other words, anyone trying to make that claim, that Rh types disprove evolution, is a racist. Just so everyone knows.",15,0,2046,2046,"",2046,"danonymous26125","maybesaydie",0
"Monkeyshines","I have *Reese's* positive blood",14,0,2046,2046,"",2046,"hngovr","maybesaydie",0
"Monkeyshines","""They've done this before""

What a fucking idiot.",10,0,2046,2046,"",2046,"barberst152","maybesaydie",0
"Monkeyshines","Ffs who let Freeza on the twitter again",7,0,2046,2046,"",2046,"onememeishboitf2","maybesaydie",0
"Monkeyshines","Anyone calling it a ""jab"" is a fucking moron and not worth listening to. Why are we sharing the same stupid shit from the same stupid people? My theory is this is from a bot.",5,0,2046,2046,"",2046,"TrailJunky","maybesaydie",0
"Monkeyshines","Ok, we finally live in a time where I can‘t differentiate between satire and reality. Good job.",4,0,2046,2046,"",2046,"kukukikika","maybesaydie",0
"Monkeyshines","What a nutjob",3,0,2046,2046,"",2046,"eightaceman","maybesaydie",0
"Monkeyshines","That’s no how it wo—you know what, never mind.",3,0,2046,2046,"",2046,"klucas503","maybesaydie",0
"Monkeyshines","So our great great great *500 greats later* great great grandparents had vaccines during their time as well? Interesting.",3,0,2046,2046,"",2046,"sonicpool69","maybesaydie",0
"Monkeyshines","What… That’s… That’s not how *any* of this works. 

I’m almost impressed by how many different levels of wrong this person packed into one tweet.",3,0,2046,2046,"",2046,"nautilus_striven","maybesaydie",0
"Monkeyshines","OMG! What kind of idiots do we have in this country! Did she never go to high school? Maybe she is someone who looks 
at Michelangelo’s David and sees pornography?",3,0,2046,2046,"",2046,"windreamerskysong","maybesaydie",0
"Monkeyshines","Wobble wibble",2,0,2046,2046,"",2046,"eightaceman","maybesaydie",0
"Monkeyshines","How stupid do you have to be to be convinced that Rhesus factor equates to sharing ape blood? It is called such because the factor was supposedly first identified in the blood of Rhesus macaques. 

Also, macaques aren’t apes. They belong to the [Cercopithecidae](https://en.m.wikipedia.org/wiki/Old_World_monkey) family, apes belong to the families [Hominidae](https://en.m.wikipedia.org/wiki/Hominidae) for great apes and [Hylobatidae](https://en.m.wikipedia.org/wiki/Hylobatidae) for lesser apes.",2,0,2046,2046,"",2046,"Shamadruu","maybesaydie",0
"Monkeyshines","Sounds like she's ready to send her $30 to ""Bob""",2,0,2046,2046,"",2046,"rootComplex","maybesaydie",0
"Monkeyshines","Lmao, this is a new one.",2,0,2046,2046,"",2046,"Raspberrylemonade188","maybesaydie",0
"Monkeyshines","That’s not how that works.",2,0,2046,2046,"",2046,"Jolly_Tea7519","maybesaydie",0
"Monkeyshines","Monke shot😳🙊",2,0,2046,2046,"",2046,"fricceroni","maybesaydie",0
"Monkeyshines","Does she think people started evolving from apes in 1796?",2,0,2046,2046,"",2046,"tinuvegil","maybesaydie",0
"Monkeyshines","Fun fact about the factor - if Mom is negative, but Dad and Baby are positive it can cause significant complications for future pregnancies. 

My parents have the exact same blood type (B-). Mom's doctor insisted on testing my Dad twice because she did not believe that result.",2,0,2046,2046,"",2046,"Neathra","maybesaydie",0
"Monkeyshines","I was just watching a YouTube video by The Click that had this on it! I know it’s silly but still made me chuckle.",0,0,2046,2046,"",2046,"Bjorn_The_Bear","maybesaydie",0
"Monkeyshines","there's stupid and then there's this",1,0,2046,2046,"",2046,"WarlanceLP","maybesaydie",0
"Monkeyshines","100% of us have ape blood, since we ARE apes.",1,0,2046,2046,"",2046,"TheKingOfRhye777","maybesaydie",0
"Monkeyshines","A for ape blood, B for best blood, O for wOke blood?",1,0,2046,2046,"",2046,"ravengenesis1","maybesaydie",0
"Monkeyshines","Holy fucking shit.",1,0,2046,2046,"",2046,"Mr-Warmth","maybesaydie",0
"Bills would make Rhode Islanders who refused COVID vaccines a 'protected class'","I do not want to be treated by unvaccinated healthcare workers. People should not be at risk of catching illnesses from healthcare providers especially seniors and other high risk people in nursing homes, going for dental work or babies in daycare too young to get their own vaccinations :(",18,0,14,14,"",14,"shallah","shallah",0
"Bills would make Rhode Islanders who refused COVID vaccines a 'protected class'","Protected from what? Common sense?",10,0,14,14,"",14,"timelesstimez","shallah",0
"Bills would make Rhode Islanders who refused COVID vaccines a 'protected class'","They're the opposite of protected.",7,0,14,14,"",14,"awithonelison","shallah",0
"Bills would make Rhode Islanders who refused COVID vaccines a 'protected class'","Are they going to ask for affirmative action too?",5,0,14,14,"",14,"vsandrei","shallah",0
"Bills would make Rhode Islanders who refused COVID vaccines a 'protected class'","This has to be satire, but unfortunately in America it is absolutely normal these days.",1,0,14,14,"",14,"sonicpool69","shallah",0
"Bills would make Rhode Islanders who refused COVID vaccines a 'protected class'","This kind of nonsense is how Republican legislators spend their time.",1,0,14,14,"",14,"maybesaydie","shallah",0
"Bills would make Rhode Islanders who refused COVID vaccines a 'protected class'","Democrats are doing this? Are they okay??",1,0,14,14,"",14,"PracticalApartment99","shallah",0
"This.","*gasp* This goes deeper than I ever imagined!",22,0,1361,1361,"",1361,"CaffeineFueledLife","North_Recognition199",0
"This.","That's what the Egg People TOLD me you'd say.",13,0,1361,1361,"",1361,"deathboyuk","North_Recognition199",0
"This.","But then I wont be speshul",8,0,1361,1361,"",1361,"tosety","North_Recognition199",0
"This.","I kid you now, left home for work via the freeway and EVERYONE was driving the wrong direction. Unbelievable!",6,0,1361,1361,"",1361,"Possession_Loud","North_Recognition199",0
"This.","This.",2,0,1361,1361,"",1361,"ChevyT1996","North_Recognition199",0
"This.","Same vein as if all your exes were crazy then maybe the problem was you",2,0,1361,1361,"",1361,"raindragon92","North_Recognition199",0
"Antivax Doctor blames death of 67 yr old with congenital heart problems on mRNA vaccines.","As soon as I heard about Paul, I knew something like this would happen.",14,0,99,99,"Paul O’Grady was a much loved British entertainer and died today after surviving 2 previous heart attacks, a family history of heart problems and decades of heavy smoking. Antivax doctor still somehow has not been struck off.",99,"uncle_chubb_06","majesticfloofiness",0
"Antivax Doctor blames death of 67 yr old with congenital heart problems on mRNA vaccines.","I would have used a stronger word than ""low"".

Dr. Ranj is more gracious than myself.",11,0,99,99,"Paul O’Grady was a much loved British entertainer and died today after surviving 2 previous heart attacks, a family history of heart problems and decades of heavy smoking. Antivax doctor still somehow has not been struck off.",99,"Present_End_6886","majesticfloofiness",0
"Antivax Doctor blames death of 67 yr old with congenital heart problems on mRNA vaccines.","man those mRNA vaccines are so deadly that it travels back in time and gives you a heart defect at birth. oh crap it’s every man for himself right now.",7,0,99,99,"Paul O’Grady was a much loved British entertainer and died today after surviving 2 previous heart attacks, a family history of heart problems and decades of heavy smoking. Antivax doctor still somehow has not been struck off.",99,"akuiken98","majesticfloofiness",0
"Antivax Doctor blames death of 67 yr old with congenital heart problems on mRNA vaccines.","Anything for views on the internet",6,0,99,99,"Paul O’Grady was a much loved British entertainer and died today after surviving 2 previous heart attacks, a family history of heart problems and decades of heavy smoking. Antivax doctor still somehow has not been struck off.",99,"MrSnarf26","majesticfloofiness",0
"Antivax Doctor blames death of 67 yr old with congenital heart problems on mRNA vaccines.","Paul O'Grady had well documented heart problems, but no, before a cause of death has even been given, the antivax morons are on it. 

I absolutely knew this would happen yesterday morning, when I heard he had passed away ""suddenly and peacefully"". Nobody can die suddenly anymore without these ghouls screaming about vaccines.",4,0,99,99,"Paul O’Grady was a much loved British entertainer and died today after surviving 2 previous heart attacks, a family history of heart problems and decades of heavy smoking. Antivax doctor still somehow has not been struck off.",99,"sash71","majesticfloofiness",0
"Antivax Doctor blames death of 67 yr old with congenital heart problems on mRNA vaccines.","is he a medical DR?",3,0,99,99,"Paul O’Grady was a much loved British entertainer and died today after surviving 2 previous heart attacks, a family history of heart problems and decades of heavy smoking. Antivax doctor still somehow has not been struck off.",99,"Alisseswap","majesticfloofiness",0
"Antivax Doctor blames death of 67 yr old with congenital heart problems on mRNA vaccines.","Oh yeah…just looking at some of the public shares of News Articles on FB, some of those Anti-Vaxx people that walk among us were very quick to jump on what they thought was the main issue!",3,0,99,99,"Paul O’Grady was a much loved British entertainer and died today after surviving 2 previous heart attacks, a family history of heart problems and decades of heavy smoking. Antivax doctor still somehow has not been struck off.",99,"DumpyBigSausage","majesticfloofiness",0
"Antivax Doctor blames death of 67 yr old with congenital heart problems on mRNA vaccines.","Even if someone got run over by a car, they would try to blame it on the vaccine",3,0,99,99,"Paul O’Grady was a much loved British entertainer and died today after surviving 2 previous heart attacks, a family history of heart problems and decades of heavy smoking. Antivax doctor still somehow has not been struck off.",99,"timelesstimez","majesticfloofiness",0
"Antivax Doctor blames death of 67 yr old with congenital heart problems on mRNA vaccines.","Omg it's almost like heart disease is the leading killer of Americans! Who knew??? 

(/s in case it wasn't obvious)",1,0,99,99,"Paul O’Grady was a much loved British entertainer and died today after surviving 2 previous heart attacks, a family history of heart problems and decades of heavy smoking. Antivax doctor still somehow has not been struck off.",99,"SignificantName59","majesticfloofiness",0
"Several southern Ontario public health units warn whooping cough on the rise | Southwestern Public Health ...said it recorded 82 cases of whooping cough from January 2022 to the end of this February.","“In our region, we have relatively lower rates of immunization compared to others,” Tran said.

“We’ve had a few cases that were hospitalized. That’s why we just really need folks to get up-to-date on their immunization.”

Huron Perth Public Health, which serves Stratford, Wingham, Listowel and Clinton, said it has confirmed at least 21 cases of whooping cough so far this year. In 2022, there were only three cases.

“The illness can be serious for infants younger than 12 months of age who are not vaccinated, or who have not received all doses of the pertussis vaccine,” Dr. Miriam Klassen, the medical officer of health for Huron Perth, wrote in a statement.",3,0,40,40,"",40,"shallah","shallah",0
"Several southern Ontario public health units warn whooping cough on the rise | Southwestern Public Health ...said it recorded 82 cases of whooping cough from January 2022 to the end of this February.","This is just sad. All these preventable diseases cropping up all over the place. Antivaxxers need to do some real research about them. Heck, just read a book written by an author in that time period to see how bad they can be. I learned about smallpox from LM Montgomery",1,0,40,40,"",40,"blakesmate","shallah",0
"Shifting burden of proof. Asking your opponent(s) to disprove “your” argument when they ask you evidence for it.","sure I do. <posts link to articles and studies that have been debunked countless times> 😌",84,0,748,748,"",748,"Quaschimodo","North_Recognition199",0
"Shifting burden of proof. Asking your opponent(s) to disprove “your” argument when they ask you evidence for it.","Here's a fun story. An Antivax group funded a study to prove that vaccines cause autism over a 10 year period.

The results ended up showing that there was no link. 

[https://www.newsweek.com/anti-vaxxers-accidentally-fund-study-showing-theres-no-link-between-autism-and-379245](https://www.newsweek.com/anti-vaxxers-accidentally-fund-study-showing-theres-no-link-between-autism-and-379245)

They found out the hard way, that you can't buy science.",44,0,748,748,"",748,"TunnelTuba","North_Recognition199",0
"Shifting burden of proof. Asking your opponent(s) to disprove “your” argument when they ask you evidence for it.","but vaccines do cause autism, vaccinated people get to live old enough to repopulate and repopulation has a chance to cause autistic people to be created so while not the most solid connection vaccines help create more autism",13,0,748,748,"",748,"Robosium","North_Recognition199",0
"Shifting burden of proof. Asking your opponent(s) to disprove “your” argument when they ask you evidence for it.","The great thing about delusion is that proof is not required.",11,0,748,748,"",748,"Cucker_Tarlson_666","North_Recognition199",0
"Shifting burden of proof. Asking your opponent(s) to disprove “your” argument when they ask you evidence for it.","They cite random anecdotes, arguments based solely on feelings/fear, and disproven “”studies”” that are decades old at this point.

You cant ‘logic’ your way out of a viewpoint you didnt use logic to arrive to.",9,0,748,748,"",748,"blackmobius","North_Recognition199",0
"Shifting burden of proof. Asking your opponent(s) to disprove “your” argument when they ask you evidence for it.","[The proof is inside my teapot, currently floating through space. ](https://en.wikipedia.org/wiki/Russell%27s_teapot)",7,0,748,748,"",748,"piclemaniscool","North_Recognition199",0
"Shifting burden of proof. Asking your opponent(s) to disprove “your” argument when they ask you evidence for it.","That which is asserted without proof may be dismissed without proof.",3,0,748,748,"",748,"PhantomBanker","North_Recognition199",0
"Shifting burden of proof. Asking your opponent(s) to disprove “your” argument when they ask you evidence for it.","Weird strawman, they usually either say to do your research or post that one vaccine paper that was repeatedly disproven",5,0,748,748,"",748,"ArthurExtreme_Br","North_Recognition199",0
"Shifting burden of proof. Asking your opponent(s) to disprove “your” argument when they ask you evidence for it.","I am the one holding the null hypothesis, that the things that have worked are working still. YOU have to have evidence to disprove ME, not the other way around.",1,0,748,748,"",748,"EliteSoviet1","North_Recognition199",0
"Facebook antivaxxers store TikTok clips on their galleries like some toolkit so that they can bombard you with BS. The beauty is that this is a reply to a comment (essentially) saying “ivermectin horse paste lol”","“bro someone said it on a video I watched on social media so it must be true”

THEY ALWAYS POST CONGRESS HEARINGS AS PROOF",3,0,22,22,"",22,"akuiken98","EDXE47_",0
"Facebook antivaxxers store TikTok clips on their galleries like some toolkit so that they can bombard you with BS. The beauty is that this is a reply to a comment (essentially) saying “ivermectin horse paste lol”","Full of Shitas is known For deceptive editing ☠️☠️☠️",3,0,22,22,"",22,"Misty_Milo","EDXE47_",0
"Hypocritical pro-lifers not getting vaccines.","Corona: Your body my choice.",12,0,275,275,"",275,"No_Pipe_8257","North_Recognition199",0
"Hypocritical pro-lifers not getting vaccines.","Don't get wrong anti vaxxers are hypocrites, but I never liked that comparison because it gives legitimacy to their stupid reverse of ""Oh, the left is so hypocritical, they're say ""my body my choice"", but if I want to choose for my body(and endangered anyone around me in the process) i somehow am not allowed to or get shamed for it>:(""

abortion is a private decision just affecting you, vaccines are a public health thing affecting us all, those 2 things should not be compared because they are not the same.",15,0,275,275,"",275,"mrcreepyz","North_Recognition199",0
"Hypocritical pro-lifers not getting vaccines.","In some places, they are coming back around and trying to ban COVID/ mrna vaccines.",5,0,275,275,"",275,"Ladidiladidah","North_Recognition199",0
"Credit to: thelogicofscience.com","This maybe a case of insecurity. Most people believe that with a little practice and education they could easily do the work of a plumber or car mechanic, they just choose not to. But science, most of us don't have that kind of dedication or intelligence and could never hope to achieve that level of skill no matter how much effort was applied. Some find that threatening and therefore disparage those that can. As the saying goes, ""nobody likes a smart arse.""",5,0,80,80,"",80,"Cactus-Badger","North_Recognition199",0
"False analogy. Again.","It's this simple and they still don't understand it. I've heard people say ""why don't people with cancer wear masks then since that's so deadly?""

That's because people don't spread cancer Karen.......",20,0,179,179,"",179,"HendoRules","North_Recognition199",0
"False analogy. Again.","If you don't want vaccinated that's fine. Just don't think you have the right to travel around in public places spreading communicable diseases. The world before vaccines was a world of quarantines.",16,0,179,179,"",179,"I_might_be_weasel","North_Recognition199",0
"False analogy. Again.","No one is having vaccines forced on them though...",9,0,179,179,"",179,"translove228","North_Recognition199",0
"False analogy. Again.","Here in simple words: You don't catch the pregnant by being in a room with a pregnant person.",7,0,179,179,"",179,"coveness13","North_Recognition199",0
"False analogy. Again.","I would be fine with this argument in theory if these idiots were consistent: pro-choice for both then!!  But they’re always the ones who want to make vaccines “pro-choice” (most already are) but not abortions.",6,0,179,179,"",179,"MysticoftheWild","North_Recognition199",0
"False analogy. Again.","This illustrates well the problems the left have with messaging:

* GOP: inflammatory bumpersticker-size bullshit
* Dems: actually, it's more complicated/nuanced than that

And our audience's eyes glaze over.  We really need to figure this out.",3,0,179,179,"",179,"NobleExperiments","North_Recognition199",0
"False analogy. Again.","Vaccine is a protection for society, abortion is an individual choice.",3,0,179,179,"",179,"KittenKoder","North_Recognition199",0
"False analogy. Again.","And not having access to abortions has killed a lot more people than a vaccine ever will. And any vaccine that has a pattern of killing people (so like, nine out of thousands) gets discontinued.",3,0,179,179,"",179,"callmefreak","North_Recognition199",0
"Husbands hate him for this one simple trick","Why even bother blocking out the name? We all know it's that idiot who thinks he's an alpha male on twitter. He'd shit himself if confronted by anyone. Man writes more fiction than Hemmingway",518,0,1005,1005,"",1005,"master_arca","yourfrndmichael",0
"Husbands hate him for this one simple trick","And everybody clapped.",526,0,1005,1005,"",1005,"DrHugh","yourfrndmichael",0
"Husbands hate him for this one simple trick","> I overheard the wife talking to a friend in hushed tones. She was recounting the situation and said she had forgotten what a real man looks like prior to today. She mentioned how impressed she was with my powerful and authoritative demeanor. She told her friend she was having second thoughts about her marriage and wrapped up the call.

Oh dear. Narcissist fanfic.

> She was intoxicated by my masculinity

Ha just seen a picture of him.",222,0,1005,1005,"",1005,"Living_Carpets","yourfrndmichael",0
"Husbands hate him for this one simple trick","1) No one is asking another fucking person in 1st class to put on a mask.

2) This guy has no idea what any woman has ever wanted.

3) what does “made it crystal clear” mean? Who the fuck waits in the line at the Starbucks in the airport *they arrived* at? How the shit did this guy hear a conversation of a woman from anywhere but uncomfortably close enough and *still*, somehow, make eye contact?

4) why, the fuck, would anyone, anyone at all, believe another guy in first class would tolerate this shit for a fucking second?

5) seriously, who is this for except this limp-dicked, rude twat?",163,0,1005,1005,"",1005,"Thirdwhirly","yourfrndmichael",0
"Husbands hate him for this one simple trick","And then I woke up",116,0,1005,1005,"",1005,"0bxyz","yourfrndmichael",0
"Husbands hate him for this one simple trick","*""Things that never happened"" -* by Fragile Frank",210,0,1005,1005,"",1005,"Cucker_Tarlson_666","yourfrndmichael",0
"Husbands hate him for this one simple trick","(Alpha Male...  In case you couldn't tell, because most people can't, but I am very Alpha.  Trust me bro)",69,0,1005,1005,"",1005,"convicted_snob","yourfrndmichael",0
"Husbands hate him for this one simple trick","“I’m so powerful and authoritative that I need to brag on Reddit.”",56,0,1005,1005,"",1005,"Toroceratops","yourfrndmichael",0
"Husbands hate him for this one simple trick","Can’t these idiots make these stupid posts even slightly believable?",40,0,1005,1005,"",1005,"OldLadyP","yourfrndmichael",0
"Husbands hate him for this one simple trick","And that Marine was Albert Einstein!",25,0,1005,1005,"",1005,"Mr_Upright","yourfrndmichael",0
"Husbands hate him for this one simple trick","And then someone gave him 50 dollars",27,0,1005,1005,"",1005,"Cardans1328","yourfrndmichael",0
"Husbands hate him for this one simple trick","Dear Penthouse equivalent for covidiots.",14,0,1005,1005,"",1005,"Logical_Sprinkles_21","yourfrndmichael",0
"Husbands hate him for this one simple trick","And then everyone clapped.

Even for fiction, this is pretty damned bad.",13,0,1005,1005,"",1005,"NobleExperiments","yourfrndmichael",0
"Husbands hate him for this one simple trick","On today's episode of 'things that absolutely happened'",13,0,1005,1005,"",1005,"timelesstimez","yourfrndmichael",0
"Husbands hate him for this one simple trick","Imagine making up a fake story and _this_ is it.",11,0,1005,1005,"",1005,"BeerLeagueSnipes","yourfrndmichael",0
"Husbands hate him for this one simple trick","No woman is ever going to look at a douche bag who man spreads and thinks, ""that's a real man.""",29,0,1005,1005,"",1005,"goodformuffin","yourfrndmichael",0
"Husbands hate him for this one simple trick","This is the erotica for anti-vaxxers. Oof!",10,0,1005,1005,"",1005,"VE6AEQ","yourfrndmichael",0
"Husbands hate him for this one simple trick","This man is a troll and is baiting you",25,0,1005,1005,"",1005,"TheEffingRalyks","yourfrndmichael",0
"Husbands hate him for this one simple trick","Im always shocked at how people can be so out of touch with reality to write this kinda shit down online.",10,0,1005,1005,"",1005,"Revolutionary_Rip876","yourfrndmichael",0
"Husbands hate him for this one simple trick","Serious yikes, must be tough being an incel, messes with your reality perception",16,0,1005,1005,"",1005,"AtlasShrugged-","yourfrndmichael",0
"Husbands hate him for this one simple trick","I’m immune compromised and we are flying as a family in the coming months. If my husband asked someone to mask (he wouldn’t bother) and they went off on some rant, he would probably get us kicked off the plane with his response. 

I wish an idiot would say to my face what they’re thinking when I have to wear a mask in public spaces.",7,0,1005,1005,"",1005,"Chicken_Chicken_Duck","yourfrndmichael",0
